docno,URL,text
d157,https://www.amazon.com/Amazon-Basics-Cotton-Jersey-Quilt/dp/B08FY89QSG/ref=sxin_15_trfobq2a_4_B08FY89QSG?content-id=amzn1.sym.2500a036-1c45-42a8-89a2-72bf8896ce48%3Aamzn1.sym.2500a036-1c45-42a8-89a2-72bf8896ce48&crid=32KL6R446VQOI&cv_ct_cx=blush&keywords=blush&pd_rd_i=B08FY89QSG&pd_rd_r=09707618-482a-4e82-a17b-200c1e766fd1&pd_rd_w=xlaCS&pd_rd_wg=BbEIW&pf_rd_p=2500a036-1c45-42a8-89a2-72bf8896ce48&pf_rd_r=29FFZ292MYSZ783H8VPC&qid=1668625833&sprefix=blush%2Caps%2C92&sr=1-5-c944532c-3909-4a2a-84a2-570d2ee3cd13,Amazon Basics Cotton Jersey Quilt and Sham Bed Set Down-Alternative Quilt - Twin/Twin XL Blush Product Description
d158,https://www.amazon.com/AmazonBasics-Light-Weight-Microfiber-Zipper-Closure/dp/B08356JSG9/ref=sxin_15_trfobq2a_5_B08356JSG9?content-id=amzn1.sym.2500a036-1c45-42a8-89a2-72bf8896ce48%3Aamzn1.sym.2500a036-1c45-42a8-89a2-72bf8896ce48&crid=32KL6R446VQOI&cv_ct_cx=blush&keywords=blush&pd_rd_i=B08356JSG9&pd_rd_r=09707618-482a-4e82-a17b-200c1e766fd1&pd_rd_w=xlaCS&pd_rd_wg=BbEIW&pf_rd_p=2500a036-1c45-42a8-89a2-72bf8896ce48&pf_rd_r=29FFZ292MYSZ783H8VPC&qid=1668625833&sprefix=blush%2Caps%2C92&sr=1-6-c944532c-3909-4a2a-84a2-570d2ee3cd13,Amazon Basics Light-Weight Microfiber Duvet Cover Set with Zipper Closure - Full/Queen Blush Pink Product Description
d159,https://www.amazon.com/AmazonBasics-College-Elastic-Storage-Pockets/dp/B0835F4D12/ref=sxin_15_trfobq2a_6_B0835F4D12?content-id=amzn1.sym.2500a036-1c45-42a8-89a2-72bf8896ce48%3Aamzn1.sym.2500a036-1c45-42a8-89a2-72bf8896ce48&crid=32KL6R446VQOI&cv_ct_cx=blush&keywords=blush&pd_rd_i=B0835F4D12&pd_rd_r=09707618-482a-4e82-a17b-200c1e766fd1&pd_rd_w=xlaCS&pd_rd_wg=BbEIW&pf_rd_p=2500a036-1c45-42a8-89a2-72bf8896ce48&pf_rd_r=29FFZ292MYSZ783H8VPC&qid=1668625833&sprefix=blush%2Caps%2C92&sr=1-7-c944532c-3909-4a2a-84a2-570d2ee3cd13,Amazon Basics Reversible Microfiber Bed-in-a-Bag with Elastic Storage Pockets - Twin/Twin XL Blush Dotted Stripe Product Description
d160,https://www.amazon.com/Amazon-Essentials-Womens-Standard-Lightweight/dp/B07N7ZJGG1/ref=sxin_15_trfobq2a_7_B07N7ZJGG1?content-id=amzn1.sym.2500a036-1c45-42a8-89a2-72bf8896ce48%3Aamzn1.sym.2500a036-1c45-42a8-89a2-72bf8896ce48&crid=32KL6R446VQOI&cv_ct_cx=blush&keywords=blush&pd_rd_i=B07N7ZJGG1&pd_rd_r=09707618-482a-4e82-a17b-200c1e766fd1&pd_rd_w=xlaCS&pd_rd_wg=BbEIW&pf_rd_p=2500a036-1c45-42a8-89a2-72bf8896ce48&pf_rd_r=29FFZ292MYSZ783H8VPC&qid=1668625833&sprefix=blush%2Caps%2C92&sr=1-8-c944532c-3909-4a2a-84a2-570d2ee3cd13,Amazon Essentials Women's Lightweight Lounge Terry Jogger Pajama Pant
d161,https://www.amazon.com/Maybelline-Lightweight-Blendable-Long-lasting-Enhancing/dp/B06XDYKJDJ/ref=sr_1_7?crid=32KL6R446VQOI&keywords=blush&qid=1668625833&sprefix=blush%2Caps%2C92&sr=8-7,"Maybelline Fit Me Blush Lightweight Smooth Blendable Long-lasting All-Day Face Enhancing Makeup Color Pink 1 Count Enhance skin tone with a natural blush. True-to-tone color blends seamlessly. Now Fit happens with a flattering natural yet noticeable blush. • True-to-tone color • Creamy and smooth texture for effortless blending • Available in a collection of shades designed to complement any skin tone • Wears evenly Packaging may vary, what you receive may not be what is reflected on site. Sweep blush onto the apples of the cheeks from the cheekbones to temples."
d162,https://www.amazon.com/l-f-Cosmetics-Velvety-Lightweight-Pigmented/dp/B08T7CY6JC/ref=sr_1_8?crid=32KL6R446VQOI&keywords=blush&qid=1668625833&sprefix=blush%2Caps%2C92&sr=8-8,"e.l.f. Putty Blush Creamy & Ultra Pigmented Formula Infused with Argan Oil & Vitamin E Bora Bora 0.35 Oz (10g) Say hello to that island glow! This lightweight but buildable, putty to powder blush, blends seamlessly into skin. Infused with argan oil and vitamin E for some added nourishment, this silky smooth, buildable formula will give you a flushed-from-within glow. Use with our Putty Blush Brush for easily, flawless application."
d163,https://www.amazon.com/COVERGIRL-Cheekers-Blendable-Natural-Twinkle-12/dp/B000ORPZIG/ref=sr_1_9?crid=32KL6R446VQOI&keywords=blush&qid=1668625833&sprefix=blush%2Caps%2C92&sr=8-9,COVERGIRL Cheekers Blendable Powder Blush Natural Twinkle.12 oz 1 Count Product Description
d164,https://www.amazon.com/NewBang-Palette-Highlight-Professional-Cosmetic/dp/B0928HXPKZ/ref=sr_1_10?crid=32KL6R446VQOI&keywords=blush&qid=1668625833&sprefix=blush%2Caps%2C92&sr=8-10,NewBang 8 Colors Blush Palette Matte Mineral Blush Powder Bright Shimmer Face BlushContour and Highlight Blush PaletteProfessional Facial Beauty Cosmetic Makeup Blush
d165,https://www.amazon.com/Rimmel-Maxi-Blush-Fluid-Ounce/dp/B07D7JKFDH/ref=sr_1_11?crid=32KL6R446VQOI&keywords=blush&qid=1668625833&sprefix=blush%2Caps%2C92&sr=8-11,"Rimmel Maxi Blush Wild Card Live the London look. Rimmel London Maxi Blush Wild Card Powder gives cheeks a burst of color and a captivating glow. Made with a lightweight, pigmented formula, this micro-fine blush powder blends easily and provides buildable results. Just apply with a powder brush over foundation or on bare skin and enjoy long-lasting color. It’s the London look: expression without rules, beauty without a doubt."
d166,https://www.amazon.com/KYDA-Moisturizing-Lightweight-Cruelty-free-Beauty-Happy/dp/B0BF8FWY3S/ref=sr_1_12?crid=32KL6R446VQOI&keywords=blush&qid=1668625833&sprefix=blush%2Caps%2C92&sr=8-12,KYDA Blush Beauty Wand Liquid Face Rouge with Cushion Applicator Natural Shimmer Finish Moisturizing Creamy Formula Silky Smooth Lightweight Blendable Glowing Blush Cruelty-free 0.41 fl.oz by Ownest Beauty-Happy Pink
d167,https://www.amazon.com/Bareminerals-Gen-Nude-Powder-Blush/dp/B07982K22S/ref=sr_1_13?crid=32KL6R446VQOI&keywords=blush&qid=1668625833&sprefix=blush%2Caps%2C92&sr=8-13,Bare Escentuals bareMinerals Gen Nude Powder Blush for Women 0.21 Ounce Call My Blush A cushiony powder blush with good-for-skin ingredients that gives a natural and buildable flush of color. It provides a beautiful soft-focus effect and radiant-looking complexion.
d168,https://www.amazon.com/LOreal-Match-Blush-Barely-Blushing/dp/B001ADVWZI/ref=sr_1_14?crid=32KL6R446VQOI&keywords=blush&qid=1668625833&sprefix=blush%2Caps%2C92&sr=8-14,L'Oreal True Match Blush Barely Blushing [W3-4] 0.21 oz Product Description
d169,https://www.amazon.com/COVERGIRL-Cheekbones-Contouring-Sophisticated-packaging/dp/B001A9GTVE/ref=sr_1_15?crid=32KL6R446VQOI&keywords=blush&qid=1668625833&sprefix=blush%2Caps%2C92&sr=8-15,"COVERGIRL Instant Cheekbones Contouring Blush Sophisticated Sable 240 0.29 Ounce1 Count Natural radiance made easy! Just brush on this lightweight, blendable powder blush. Each classic shade sweeps on cleanly, evenly, and comes in a beautiful mirrored compact, for a little lift, a natural glow, effortlessly-and anywhere. Dermatologically tested."
d170,https://www.amazon.com/Color-Ombre-316B-Princess-Diaquiries/dp/B01BHFLB72/ref=sr_1_16?crid=32KL6R446VQOI&keywords=blush&qid=1668625833&sprefix=blush%2Caps%2C92&sr=8-16,"Wet N Wild Color Icon Ombre Blush 316B The Princess Diaquiries Wet N Wild Color Icon Ombre Blush, 316B The Princess Diaquiries"
d171,https://www.amazon.com/sspa/click?ie=UTF8&spc=MTo1NzAyNjc2OTM2MDAyNDEwOjE2Njg2MjU4MzM6c3BfbXRmOjIwMDA3OTk1MzQwNDg5ODo6MDo6&url=%2FFOCALLURE-Highlighter-Water-resistant-Lightweight-LIGHT-MEDIUM%2Fdp%2FB0B31LP6XV%2Fref%3Dsr_1_17_sspa%3Fcrid%3D32KL6R446VQOI%26keywords%3Dblush%26qid%3D1668625833%26sprefix%3Dblush%252Caps%252C92%26sr%3D8-17-spons%26sp_csd%3Dd2lkZ2V0TmFtZT1zcF9tdGY%26psc%3D1,FOCALLURE 3 Pcs Cream Contour SticksShades with Highlighter & Bronzer & BlushNon-greasy and Water-resistant Face Contouring PenEasy to Sculpt the Face and Create a Lightweight Finishing MakeupFAIR
d172,https://www.amazon.com/sspa/click?ie=UTF8&spc=MTo1NzAyNjc2OTM2MDAyNDEwOjE2Njg2MjU4MzM6c3BfbXRmOjIwMDA4NjkyNjgxNDE5ODo6MDo6&url=%2FFOCALLURE-Highlighter-Cruelty-Free-Illuminator-Highlighters%2Fdp%2FB096S9F5GD%2Fref%3Dsr_1_18_sspa%3Fcrid%3D32KL6R446VQOI%26keywords%3Dblush%26qid%3D1668625833%26sprefix%3Dblush%252Caps%252C92%26sr%3D8-18-spons%26sp_csd%3Dd2lkZ2V0TmFtZT1zcF9tdGY%26psc%3D1,FOCALLURE Blush and Highlighter Palette3 in 1 Makeup Powder PaletteCruelty-Free Matte BlushShimmer Illuminator Highlighters for a Glowing Look#03
d173,https://www.amazon.com/sspa/click?ie=UTF8&spc=MTo1NzAyNjc2OTM2MDAyNDEwOjE2Njg2MjU4MzM6c3BfbXRmOjIwMDA5NTA3NDEwNjU5ODo6MDo6&url=%2FBrushes-Eyeshadow-Foundation-Beginners-YUESHENNAN%2Fdp%2FB0BD5KVZLP%2Fref%3Dsr_1_19_sspa%3Fcrid%3D32KL6R446VQOI%26keywords%3Dblush%26qid%3D1668625833%26sprefix%3Dblush%252Caps%252C92%26sr%3D8-19-spons%26sp_csd%3Dd2lkZ2V0TmFtZT1zcF9tdGY%26psc%3D1,7Pcs Makeup Brushes Premium Eyeshadow Brush Foundation Brush Make Up Brushes Blush Brush Eye Brush Tools for Beginners by YUESHENNAN(pink).
d174,https://www.amazon.com/sspa/click?ie=UTF8&spc=MTo1NzAyNjc2OTM2MDAyNDEwOjE2Njg2MjU4MzM6c3BfbXRmOjIwMDEwMTk1MTc3MTA5ODo6MDo6&url=%2FFOCALLURE-Buildable-Wearing-Application-Lightweight%2Fdp%2FB0BD6Z1X24%2Fref%3Dsr_1_20_sspa%3Fcrid%3D32KL6R446VQOI%26keywords%3Dblush%26qid%3D1668625833%26sprefix%3Dblush%252Caps%252C92%26sr%3D8-20-spons%26sp_csd%3Dd2lkZ2V0TmFtZT1zcF9tdGY%26psc%3D1,FOCALLURE Cream Blush MakeupBuildable Blush Stick for CheeksMatte and Dewy FinishLong WearingEasy ApplicationLightweight Multi StickBABY PINK
d175,https://www.amazon.com/wild-Blushlighter-Blush-Highlighter-Flash/dp/B082YQ6JDQ/ref=sr_1_21?crid=32KL6R446VQOI&keywords=blush&qid=1668625833&sprefix=blush%2Caps%2C92&sr=8-21,"wet n wild MegaGlo Blushlighter| Blush & Highlighter Duo| Shimmer Metallic Finish| Flash Me A blush and highlighter duo that instantly sculpts, defines, and highlights in one sweep. These soft, buildable shades contain ultra-reflective, micro-fine pearl pigments that create a luminous, radiant glow and blend to a perfect finish. Each duo has two levels of intensity for color that compliments every skin tone. Sweep on the two colors, Using them alone or blended together for contouring, or layer them on top of each other. Available in 3 cruelty-free, gluten-free and fragrance-free duo shades."
d176,https://www.amazon.com/TINTARK-Compact-Blusher-Palette-Natural/dp/B0B3WQ6HLC/ref=sr_1_22?crid=32KL6R446VQOI&keywords=blush&qid=1668625833&sprefix=blush%2Caps%2C92&sr=8-22,TINTARK Cheeky Blush Compact for Face Cheeks Talc Free Blusher Palette Matte Powder Makeup Natural Healthy Mauve Pink Magenta Peach Red Vegan Cruelty Free
d177,https://www.amazon.com/Seamlessly-Blendable-Natural-Buildable-Moisturizing/dp/B09NXM7XDX/ref=sr_1_23?crid=32KL6R446VQOI&keywords=blush&qid=1668625833&sprefix=blush%2Caps%2C92&sr=8-23,"Blush By Wet n Wild Color Icon Pink Blush Powder Makeup Nudist Society Matte Natural Glow Moisturizing Jojoba Oil Achieve color perfection with the help of this highly pigmented blush. Velvety-soft and buildable, this pressed powder blush is easy to layer on your skin for a gorgeous flush of color across the cheeks. Build it up from sheer to bold as it seamlessly blends for a flawless finish. Whether you’re a makeup newbie or a social media veteran, you’ll understand in an instant why this blush is considered a “Color Icon”."
d178,https://www.amazon.com/COVERGIRL-Classic-Color-Blush-packaging/dp/B0016N3T3K/ref=sr_1_24?crid=32KL6R446VQOI&keywords=blush&qid=1668625833&sprefix=blush%2Caps%2C92&sr=8-24,"COVERGIRL Classic Color Blush Soft Mink Long Lasting Glowing Color 0.27 fl oz Pink Blush Blush Palette Radiant Glow Blends Easily Blends with Natural Skin Tones Get that lit from within look with COVERGIRL Classic Color Blush in Soft Mink. This subtle pink blush looks natural on all types of skin tones, and is perfect for your daily makeup routine—or making any occasion extra special. Our expertly engineered formula blends effortlessly to deliver seamless color with conditioning comfort wear. This pink blush delivers definition and a flawless finish with its velvety texture and lightweight feel."
d179,https://www.amazon.com/Palladio-Blushing-Cheek-Tint-Dainty/dp/B01LHXFLAW/ref=sr_1_25?crid=32KL6R446VQOI&keywords=blush&qid=1668625833&sprefix=blush%2Caps%2C92&sr=8-25,Palladio I'm Blushing 2-in-1 Cheek and Lip Tint Buildable Lightweight Cream Blush Sheer Multi Stick Hydrating formula All day wear Easy Application Shimmery Blends Perfectly onto Skin Dainty
d180,https://www.amazon.com/Physicians-Formula-Palette-Blushing-Natural/dp/B001QX2HBU/ref=sr_1_26?crid=32KL6R446VQOI&keywords=blush&qid=1668625833&sprefix=blush%2Caps%2C92&sr=8-26,Physicians Formula Powder Palette Multi-Colored Blush Blushing Natural Physicians Formula Powder Palette Multi-Colored Blush Blushing Natural.
d181,https://www.amazon.com/Bobbi-Brown-Blush-Pretty-Packaging/dp/B008XWSENC/ref=sr_1_27?crid=32KL6R446VQOI&keywords=blush&qid=1668625833&sprefix=blush%2Caps%2C92&sr=8-27,"Bobbi Brown Blush 41 Pretty Pink (New Packaging) 0.13 Ounce A silky-sheer powder blush that instantly gives cheeks a fresh, natural-looking pop of color. This formula glides on smoothly and offers a matte finish with long-lasting wear."
d182,https://www.amazon.com/MegaGlo-Conceal-Contour-Shimmer-Multistick/dp/B01N5MWNJH/ref=sr_1_28?crid=32KL6R446VQOI&keywords=blush&qid=1668625833&sprefix=blush%2Caps%2C92&sr=8-28,"Wet n Wild MegaGlo Blush Stick Conceal & Contour Peach Bums| Shimmer | Blush Makeup Multistick | For Cheeks | Cream In one swipe of a stick, you can get catwalk-ready cheekbones, naturally flushed cheeks or an insanely glowy complexion. Toss one of these portable makeup sticks in your purse or pocket and you’ll be camera-ready in less time it takes to double tap. Available in: Strobe, Contour, Conceal and Blush."
d183,https://www.amazon.com/Revlon-Powder-Blush-Rosy-Rendezvous/dp/B01KI40CY6/ref=sr_1_29?crid=32KL6R446VQOI&keywords=blush&qid=1668625833&sprefix=blush%2Caps%2C92&sr=8-29,"Revlon Powder Blush Rosy Rendezvous  0.17 Ounce (Pack of 1) Revlon Powder Blush is a silky, lightweight, buildable blush available in 3 finishes; matte, satin, and shimmer. Color-true prismatic pigments create vibrant, multi-dimensional cheek color that looks freshly applied all day. Available in a variety of colorful shades, including a bronzer –– the perfect shade for every skin tone. Applicator brush included. Revlon is a global leader in cosmetics, hair color, fragrances, skincare, and beauty care products. One of the strongest consumer brand franchises in the world, Revlon’s products are sold in over 100 countries across six continents. Revlon revitalized the industry over the years with iconic nail and lip colors and with breakthrough technology like ColorStay transfer-resistant lipstick and makeup."
d184,https://www.amazon.com/LOreal-Paris-Perfect-Camellia-Rosewood/dp/B07Z9WT4PM/ref=sr_1_30?crid=32KL6R446VQOI&keywords=blush&qid=1668625833&sprefix=blush%2Caps%2C92&sr=8-30,"L'Oreal Paris Age Perfect Radiant Satin Blush with Camellia Oil Rosewood Finally, makeup specially designed for mature skin. Age Perfect by L'Oreal Paris, radiant satin blush is blush formulated with Camellia oil. This formula instantly provides healthy, radiant color that doesn't cake or dry. The creamy formula applies effortlessly. Enhances cheek b1s with luminous color."
d185,https://www.amazon.com/Palette-Contour-Highlight-Shimmer-Cosmetics/dp/B093GRFZPJ/ref=sr_1_31?crid=32KL6R446VQOI&keywords=blush&qid=1668625833&sprefix=blush%2Caps%2C92&sr=8-31,Makeup 8 Color Blush Palette Contour and Highlight Blush Palette Matte Blush Powder Bright Shimmer Face Cosmetics Blusher Light Face Blush Palette with Blush Brush
d186,https://www.amazon.com/Physicians-Formula-Matte-Butter-Mattes/dp/B09NXPV5Y9/ref=sr_1_32?crid=32KL6R446VQOI&keywords=blush&qid=1668625833&sprefix=blush%2Caps%2C92&sr=8-32,"Physicians Formula Matte Monoi Butter Blush Makeup Powder Blush Mauvy Mattes Escape to paradise with this luxuriously creamy Matte Monoi Butter Blush from Physicians Formula. Based on our iconic butter blend of Murumuru Butter, Cupuacu Butter, and Tucuma Butter, this enhanced blush adds Tahitian Monoi Butter to mix for a luxuriously creamy, skin-loving blush that kisses your skin with a warm splash of natural color. Add in a long-lasting matte finish, and the goodness of essential fatty acids and pro-vitamins, and you’ve got a skin-conditioning, water-resistant blush that makes you look and feel radiant. About Physicians Formula: It all started in 1937, when leading allergist Dr. Frank Crandall created Physicians Formula as an expression of love for his wife Edith, who suffered from lupus and longed for makeup that wouldn’t aggravate her sensitive skin. Since then, we have continued Dr. Crandall’s concept of “healthy beauty.” To this day, every one of our products is carefully crafted and tested to meet our strict requirements: they are hypoallergenic, safe for sensitive skin and eyes, and created without any of the 150+ known harsh ingredients found in other personal care items."
d187,https://www.amazon.com/sspa/click?ie=UTF8&spc=MTo1NzAyNjc2OTM2MDAyNDEwOjE2Njg2MjU4MzM6c3BfbXRmOjIwMDAxMjc5MjkzNjA3MTo6MDo6&url=%2FJolie-Creme-Creamy-Colour-Lullaby%2Fdp%2FB01FVGO1P2%2Fref%3Dsr_1_33_sspa%3Fcrid%3D32KL6R446VQOI%26keywords%3Dblush%26qid%3D1668625833%26sprefix%3Dblush%252Caps%252C92%26sr%3D8-33-spons%26sp_csd%3Dd2lkZ2V0TmFtZT1zcF9tdGY%26psc%3D1%26smid%3DA1NVQRBD7SJBN8,Jolie Creme Blush Creamy Cheek Colour (Lullaby)
d188,https://www.amazon.com/sspa/click?ie=UTF8&spc=MTo1NzAyNjc2OTM2MDAyNDEwOjE2Njg2MjU4MzM6c3BfbXRmOjIwMDA5OTc4MDY2MDgyMTo6MDo6&url=%2FHey-Dewy-Rechargeable-Skin-Nourishing-Humidifier%2Fdp%2FB09HMP27F2%2Fref%3Dsr_1_34_sspa%3Fcrid%3D32KL6R446VQOI%26keywords%3Dblush%26qid%3D1668625833%26sprefix%3Dblush%252Caps%252C92%26sr%3D8-34-spons%26sp_csd%3Dd2lkZ2V0TmFtZT1zcF9tdGY%26psc%3D1,Hey Dewy Wireless Rechargeable Self-Care Skin-Nourishing Hydrating Portable Cool Mist Humidifier (Blush)
d189,https://www.amazon.com/sspa/click?ie=UTF8&spc=MTo1NzAyNjc2OTM2MDAyNDEwOjE2Njg2MjU4MzM6c3BfbXRmOjIwMDA2NDQyNjU3MDI5ODo6MDo6&url=%2FPalladio-Blushing-Cheek-Tint-Dainty%2Fdp%2FB01LHXFLAW%2Fref%3Dsr_1_35_sspa%3Fcrid%3D32KL6R446VQOI%26keywords%3Dblush%26qid%3D1668625833%26sprefix%3Dblush%252Caps%252C92%26sr%3D8-35-spons%26sp_csd%3Dd2lkZ2V0TmFtZT1zcF9tdGY%26psc%3D1,Palladio I'm Blushing 2-in-1 Cheek and Lip Tint Buildable Lightweight Cream Blush Sheer Multi Stick Hydrating formula All day wear Easy Application Shimmery Blends Perfectly onto Skin Dainty
d190,https://www.amazon.com/sspa/click?ie=UTF8&spc=MTo1NzAyNjc2OTM2MDAyNDEwOjE2Njg2MjU4MzM6c3BfbXRmOjIwMDA5MzgzNDUzNjQ5ODo6MDo6&url=%2FPalladio-Five-Color-Hues-Shimmering-Pigmented-Flawless%2Fdp%2FB002NYLLYA%2Fref%3Dsr_1_36_sspa%3Fcrid%3D32KL6R446VQOI%26keywords%3Dblush%26qid%3D1668625833%26sprefix%3Dblush%252Caps%252C92%26sr%3D8-36-spons%26sp_csd%3Dd2lkZ2V0TmFtZT1zcF9tdGY%26psc%3D1,Palladio 2-In-1 Mosaic Blush and Bronzer Silky Smooth Face Makeup Pressed Powder Five Color Hues from Shimmering Pinks to Golden Browns Rich Pigmented Shades Flawless Finish Desert Rose 0.3 Oz
d191,https://www.amazon.com/wild-Color-Powder-Blush-Pinch/dp/B082YPNTZ4/ref=sr_1_37?crid=32KL6R446VQOI&keywords=blush&qid=1668625833&sprefix=blush%2Caps%2C92&sr=8-37,Wet n Wild Color Icon Blush Powder Makeup Pinch Me Pink | Matte Natural Glow | Moisturizing Jojoba Oil Our new and improved formula in the most iconic and sought after prestige blush shades. A velvety-soft pressed powder formula that is buildable and lets you layer on your color - from sheer to bold. A long-wearing blush that blends seamlessly and applies evenly for a healthy-looking flush of silky smooth color. Shades range from soft neutrals to vivid pops of color that compliment all skin tones.
d192,https://www.amazon.com/Matte-Liquid-Cream-Makeup-Lightweight/dp/B096LSDVSR/ref=sr_1_38?crid=32KL6R446VQOI&keywords=blush&qid=1668625833&sprefix=blush%2Caps%2C92&sr=8-38,Matte Liquid Cream Blush Makeup Lightweight - Velvet Mousse Texture Breathable Feel Sheer Flush Of Color Natural-Looking Blush Stick for Cheek Advanced Hazy Feeling(#01#02#03)
d193,https://www.amazon.com/Physicians-Formula-Murumuru-Butter-Blush/dp/B085M5TNC9/ref=sr_1_39?crid=32KL6R446VQOI&keywords=blush&qid=1668625833&sprefix=blush%2Caps%2C92&sr=8-39,"Blush By Physicians Formula Murumuru Butter Blush Makeup Powder Saucy Mauve WHAT IT IS: An ultra-luxurious blush, infused with Murumuru Butter to deliver a radiant Brazilian goddess glow! Incredibly creamy and soft texture combines the best features of a powder and cream blush, to deliver a lit-from-within tropical glow unlike any other. WHY IT'S GOOD FOR YOU: Infused with a powerful blend of Murumuru Butter, Cupuacu Butter, and Tucuma Butter, from the lush and nutrient-rich Amazon. Packed with essential fatty acids and pro-vitamins that soften, condition and moisturize skin, leaivng it silky soft."
d194,https://www.amazon.com/COVERGIRL-Trueblend-Flushed-Pigment-Bronzer/dp/B088P51BYY/ref=sr_1_40?crid=32KL6R446VQOI&keywords=blush&qid=1668625833&sprefix=blush%2Caps%2C92&sr=8-40,COVERGIRL COVERGIRL Trueblend so Flushed High Pigment Blush & Bronzer Love Me Love Me 0.33 Ounce All-day wear: formula feels comfortable throughout the day.
d195,https://www.amazon.com/Milani-Cheek-Liquid-Blush-Makeup/dp/B089NGY776/ref=sr_1_41?crid=32KL6R446VQOI&keywords=blush&qid=1668625833&sprefix=blush%2Caps%2C92&sr=8-41,Milani Cheek Kiss Liquid Blush Makeup - Blendable & Buildable Cheek Blush Lightweight Liquid Blusher and Cheek Color
d196,https://www.amazon.com/NYX-Professional-Makeup-Powder-0-14-Ounce/dp/B002QI4S9S/ref=sr_1_42?crid=32KL6R446VQOI&keywords=blush&qid=1668625833&sprefix=blush%2Caps%2C92&sr=8-42,"NYX Professional Makeup Powder Blush Mocha 0.14-Ounce Silky textured blush. Featured in a signature quilted compact. Rich pigmentation provides long-lasting wear. Delivers a healthy, radiant natural glow."
d197,https://www.amazon.com/Ucanbe-Waterproof-Colors-Blusher-Palette/dp/B00WG6WLUI/ref=sr_1_43?crid=32KL6R446VQOI&keywords=blush&qid=1668625833&sprefix=blush%2Caps%2C92&sr=8-43,Ucanbe Waterproof 5 Colors Blusher Palette with Blush Brush
d198,https://www.amazon.com/Physicians-Formula-Murumuru-Butter-Natural/dp/B01N9LBVPF/ref=sr_1_44?crid=32KL6R446VQOI&keywords=blush&qid=1668625833&sprefix=blush%2Caps%2C92&sr=8-44,"Blush By Physicians Formula Murumuru Butter Blush Makeup Powder Natural Glow Brazillian Luxury Ultra-luxurious formula, infused with Murumuru Butter, delivers a radiant Brazilian goddess glow! Moisturizing wonder features ultra-refined pearl and soft-focus pigments that smooth skin texture, brighten skin tone, and deliver a gorgeous blushing glow. Incredibly soft and ultra-creamy texture combines the best features of a powder and cream blush. Skin-Loving Blend Infused with a powerful blend of Murumuru Butter, Cupuacu Butter and Tucuma Butter, from the lush and nutrient-rich Amazon. Packed with essential fatty acids and pro-vitamins that soften, condition and moisturize skin, leaving it silky soft. Mirror & Applicator Included."
d199,https://www.amazon.com/Makeup-Mineral-Liquid-Fibers-Ergonomic/dp/B01EO2KP2M/ref=sr_1_45?crid=32KL6R446VQOI&keywords=blush&qid=1668625833&sprefix=blush%2Caps%2C92&sr=8-45,"wet n wild Makeup Brush| Blush Brush| For Mineral & Liquid Makeup| Plush Fibers| Ergonomic Handle Featuring two-toned synthetic Polymax fibers made of an exclusive thermoplastic polymer complex that mimics the consistency of natural hairs to pick up formula effortlessly. Holds any cream, powder, or liquid formula without absorption. Exclusively designed ergonomic handle fits perfectly in your hand for precise application."
d200,https://www.amazon.com/wild-Color-Powder-Blush-Pearlescent/dp/B082YPZMT6/ref=sr_1_46?crid=32KL6R446VQOI&keywords=blush&qid=1668625833&sprefix=blush%2Caps%2C92&sr=8-46,Wet n Wild Color Icon Blush Powder Makeup Pearlescent Pink | Matte Natural Glow | Moisturizing Jojoba Oil Our new and improved formula in the most iconic and sought after prestige blush shades. A velvety-soft pressed powder formula that is buildable and lets you layer on your color - from sheer to bold. A long-wearing blush that blends seamlessly and applies evenly for a healthy-looking flush of silky smooth color. Shades range from soft neutrals to vivid pops of color that compliment all skin tones.
d201,https://www.amazon.com/l-f-Cosmetics-Palette-Beautiful-Long-Lasting/dp/B00J56D0G6/ref=sr_1_47?crid=32KL6R446VQOI&keywords=blush&qid=1668625833&sprefix=blush%2Caps%2C92&sr=8-47,"e.l.f. Cosmetics Powder Blush Palette Four Blush Shades for Beautiful Long-Lasting Pigment Light Reveal beautiful, radiant looking skin with the Powder Blush Palette from e.l.f. Cosmetics. This palette features four shimmering blushes that can be used individually or mixed and matched for a custom look. Use this palette, along with your favorite bronzer and highlighter to contour and define for your facial features for a gorgeous look. e.l.f. Cosmetics offers a complete line of vegan and cruelty-free makeup and professional tools - all at an extraordinary value price, so there is sure to be something for everyone. See bullets and images for more information."
