docno,URL,text
d0,https://www.amazon.com/sspa/click?ie=UTF8&spc=MTo4OTc5Mzc5OTExOTg5NzM5OjE2Njg2MjU3NDA6c3BfYXRmOjIwMDEwNjIwMTQ3MzYzMTo6MDo6&url=%2FAlmay-Enhancing-Longlasting-Antioxidant-Hypoallergenic%2Fdp%2FB08MRRNL17%2Fref%3Dsr_1_1_sspa%3Fcrid%3D1QJ2Z0KOR688P%26keywords%3Deyeshadow%26qid%3D1668625740%26sprefix%3Deyeshadow%252Caps%252C92%26sr%3D8-1-spons%26sp_csd%3Dd2lkZ2V0TmFtZT1zcF9hdGY%26psc%3D1,"Eyeshadow Palette by Almay Longlasting Eye Makeup Primer Enriched with Antioxidant Vitamin E Hypoallergenic 010 Brown Eyes 0.1 Oz Create beautifully enhanced, brighter looking eyes with the Almay Intense i-color Shadow Palette™, a richly pigmented five-shadow assortment expertly curated by eye color: brown eyes, blue eyes, green eyes, hazel eyes. Each of our four compacts comes with an antioxidant vitamin E-enriched primer base that smooths lids, extends wear of eye shadows, and protects against environmental stressors. Also included are four creamy eye shadows in a variety of finishes that last without creasing, smudging, or fading. Not only is choosing your eye palette easy, so is the application. While the palette mimics the shape of your eye, each pan is labeled with a directional number to make building your look effortless—whether you’re a novice or a pro. Formulated with sensitive eyes in mind, this versatile eye shadow kit is perfect for a wide range of looks including transitioning your eye makeup from day to night. And because we love the environment as much as we love your delicate eyes, we’ve made the packaging from sustainably sourced paper. Formulated without added parabens, phthalates, SLS, mineral oil, DMDM Hydantoin, formaldehydes, and Triclosan. Suitable for contact lens wearers. As always, hypoallergenic. Ophthalmologist tested. Clean. Cruelty free. Fragrance free."
d1,https://www.amazon.com/sspa/click?ie=UTF8&spc=MTo4OTc5Mzc5OTExOTg5NzM5OjE2Njg2MjU3NDA6c3BfYXRmOjIwMDA2NDc4MjYwMjU5ODo6MDo6&url=%2FMaybelline-New-York-Eyeshadow-Palette%2Fdp%2FB09VCXWCGB%2Fref%3Dsr_1_2_sspa%3Fcrid%3D1QJ2Z0KOR688P%26keywords%3Deyeshadow%26qid%3D1668625740%26sprefix%3Deyeshadow%252Caps%252C92%26sr%3D8-2-spons%26sp_csd%3Dd2lkZ2V0TmFtZT1zcF9hdGY%26psc%3D1,"Maybelline New York Shadow Blocks Shadow Blocks Eyeshadow Palette Stacked Eye Shadow Trio 82nd & Park Ave 0.08 oz Big impact color in a pocket-size hassle free palette: Maybelline New York Shadow Blocks eyeshadow trios stack high-pigment eyeshadow for no-mess application. Inspired by the city streets in some of NYC’s most vibrant neighborhoods, each eye palette is packed with pigmented, blendable shadow in 2 matte shades + 1 shimmer shade. Shadow Blocks is available in 5 curated palettes to create your custom eye shadow looks. Whether you’re pairing purple shades inspired by the streets of Soho or taking on the blocks of Brooklyn with a neutral eye shadow look, Shadow Blocks’ travel-friendly packaging makes it easy to apply on-the-go."
d2,https://www.amazon.com/L-Girl-Beauty-Eyeshadow/dp/B00PGQYEUK/ref=sr_1_3?crid=1QJ2Z0KOR688P&keywords=eyeshadow&qid=1668625740&sprefix=eyeshadow%2Caps%2C92&sr=8-3,L.A. Girl Beauty Brick Eyeshadow Nudes 0.42 Ounce Four gorgeous must-have eyeshadow palettes filled with a dozen majorly pigmented shades ranging from super wearable looks like nudes to bolder looks like neon's. L.a. Girl's beauty brick eyeshadow collection gives you the best of all colors to allow you to create stunning looks! The variety of colors and textures include shimmer and matte shades making these captivating palettes very versatile to go from an everyday look to a night out. Each unique look is featured in its own luxurious glossy book with a double-ended brush and mirror inside.
d3,https://www.amazon.com/CHANGEABLE-Eyeshadow-Highlight-Waterproof-Makeup/dp/B07MQJRK7N/ref=sr_1_4?crid=1QJ2Z0KOR688P&keywords=eyeshadow&qid=1668625740&sprefix=eyeshadow%2Caps%2C92&sr=8-4,Highly Pigmented Eye Makeup Palette  Matte Shimmer Metallic Eyeshadow Pallet Long Lasting Blendable Natural Colors Make Up Eye Shadows Cosmetics Gift Kit
d4,https://www.amazon.com/Naked2-Basics-Eyeshadow-Palette-Neutral/dp/B07LBLK57Q/ref=sr_1_5?crid=1QJ2Z0KOR688P&keywords=eyeshadow&qid=1668625740&sprefix=eyeshadow%2Caps%2C92&sr=8-5,Urban Decay Naked2 Basics Eyeshadow Palette 6 Taupe & Brown Matte Neutral Shades - Ultra-Blendable Rich Colors with Velvety Texture - Makeup Set Includes Mirror & Full-Size Pans - Great for Travel
d5,https://www.amazon.com/Almay-Enhancing-Longlasting-Antioxidant-Hypoallergenic/dp/B08MRRNL17/ref=sxin_13_pa_sp_search_thematic_mod_primary_new?content-id=amzn1.sym.4e7a2229-074e-44de-95c4-9fd858f46295%3Aamzn1.sym.4e7a2229-074e-44de-95c4-9fd858f46295&crid=1QJ2Z0KOR688P&cv_ct_cx=eyeshadow&keywords=eyeshadow&pd_rd_i=B08MRRNL17&pd_rd_r=081c5608-9884-4615-a068-e8040d6e2b04&pd_rd_w=jWHJZ&pd_rd_wg=0TwJC&pf_rd_p=4e7a2229-074e-44de-95c4-9fd858f46295&pf_rd_r=ME1NVC79G6ZH41G7BNA7&qid=1668625740&sbo=RZvfv%2F%2FHxDF%2BO5021pAnSA%3D%3D&sprefix=eyeshadow%2Caps%2C92&sr=1-1-a73d1c8c-2fd2-4f19-aa41-2df022bcb241,"Eyeshadow Palette by Almay Longlasting Eye Makeup Primer Enriched with Antioxidant Vitamin E Hypoallergenic 010 Brown Eyes 0.1 Oz Create beautifully enhanced, brighter looking eyes with the Almay Intense i-color Shadow Palette™, a richly pigmented five-shadow assortment expertly curated by eye color: brown eyes, blue eyes, green eyes, hazel eyes. Each of our four compacts comes with an antioxidant vitamin E-enriched primer base that smooths lids, extends wear of eye shadows, and protects against environmental stressors. Also included are four creamy eye shadows in a variety of finishes that last without creasing, smudging, or fading. Not only is choosing your eye palette easy, so is the application. While the palette mimics the shape of your eye, each pan is labeled with a directional number to make building your look effortless—whether you’re a novice or a pro. Formulated with sensitive eyes in mind, this versatile eye shadow kit is perfect for a wide range of looks including transitioning your eye makeup from day to night. And because we love the environment as much as we love your delicate eyes, we’ve made the packaging from sustainably sourced paper. Formulated without added parabens, phthalates, SLS, mineral oil, DMDM Hydantoin, formaldehydes, and Triclosan. Suitable for contact lens wearers. As always, hypoallergenic. Ophthalmologist tested. Clean. Cruelty free. Fragrance free."
d6,https://www.amazon.com/Almay-Enhancing-Longlasting-Antioxidant-Hypoallergenic/dp/B08MRRNL17/ref=sxin_13_pa_sp_search_thematic_mod_primary_new?content-id=amzn1.sym.4e7a2229-074e-44de-95c4-9fd858f46295%3Aamzn1.sym.4e7a2229-074e-44de-95c4-9fd858f46295&crid=1QJ2Z0KOR688P&cv_ct_cx=eyeshadow&keywords=eyeshadow&pd_rd_i=B08MRRNL17&pd_rd_r=081c5608-9884-4615-a068-e8040d6e2b04&pd_rd_w=jWHJZ&pd_rd_wg=0TwJC&pf_rd_p=4e7a2229-074e-44de-95c4-9fd858f46295&pf_rd_r=ME1NVC79G6ZH41G7BNA7&qid=1668625740&sbo=RZvfv%2F%2FHxDF%2BO5021pAnSA%3D%3D&sprefix=eyeshadow%2Caps%2C92&sr=1-1-a73d1c8c-2fd2-4f19-aa41-2df022bcb241,"Eyeshadow Palette by Almay Longlasting Eye Makeup Primer Enriched with Antioxidant Vitamin E Hypoallergenic 010 Brown Eyes 0.1 Oz Create beautifully enhanced, brighter looking eyes with the Almay Intense i-color Shadow Palette™, a richly pigmented five-shadow assortment expertly curated by eye color: brown eyes, blue eyes, green eyes, hazel eyes. Each of our four compacts comes with an antioxidant vitamin E-enriched primer base that smooths lids, extends wear of eye shadows, and protects against environmental stressors. Also included are four creamy eye shadows in a variety of finishes that last without creasing, smudging, or fading. Not only is choosing your eye palette easy, so is the application. While the palette mimics the shape of your eye, each pan is labeled with a directional number to make building your look effortless—whether you’re a novice or a pro. Formulated with sensitive eyes in mind, this versatile eye shadow kit is perfect for a wide range of looks including transitioning your eye makeup from day to night. And because we love the environment as much as we love your delicate eyes, we’ve made the packaging from sustainably sourced paper. Formulated without added parabens, phthalates, SLS, mineral oil, DMDM Hydantoin, formaldehydes, and Triclosan. Suitable for contact lens wearers. As always, hypoallergenic. Ophthalmologist tested. Clean. Cruelty free. Fragrance free."
d7,https://www.amazon.com/sspa/click?ie=UTF8&spc=MTo0MTkwNDk1ODY1OTQyNTUzOjE2Njg2MjU3NDA6c3Bfc2VhcmNoX3RoZW1hdGljOjIwMDA2OTY4NDAxMjYzMTo6MTo6&url=%2FJulep-Eyeshadow-Powder-Waterproof-Amethyst%2Fdp%2FB088ZYMQSJ%2Fref%3Dsxin_13_pa_sp_search_thematic_sspa%3Fcontent-id%3Damzn1.sym.4e7a2229-074e-44de-95c4-9fd858f46295%253Aamzn1.sym.4e7a2229-074e-44de-95c4-9fd858f46295%26crid%3D1QJ2Z0KOR688P%26cv_ct_cx%3Deyeshadow%26keywords%3Deyeshadow%26pd_rd_i%3DB088ZYMQSJ%26pd_rd_r%3D081c5608-9884-4615-a068-e8040d6e2b04%26pd_rd_w%3DjWHJZ%26pd_rd_wg%3D0TwJC%26pf_rd_p%3D4e7a2229-074e-44de-95c4-9fd858f46295%26pf_rd_r%3DME1NVC79G6ZH41G7BNA7%26qid%3D1668625740%26sprefix%3Deyeshadow%252Caps%252C92%26sr%3D1-2-a73d1c8c-2fd2-4f19-aa41-2df022bcb241-spons%26sp_csd%3Dd2lkZ2V0TmFtZT1zcF9zZWFyY2hfdGhlbWF0aWM%26psc%3D1%26smid%3DA1LHJFDVRQU851,Julep Eyeshadow 101 Crème to Powder Waterproof Eyeshadow Stick Smoky Amethyst
d8,https://www.amazon.com/sspa/click?ie=UTF8&spc=MTo0MTkwNDk1ODY1OTQyNTUzOjE2Njg2MjU3NDA6c3Bfc2VhcmNoX3RoZW1hdGljOjIwMDA4NDUzNjcyNDczMTo6Mjo6&url=%2FJulep-Eyeshadow-Powder-Waterproof-Shimmer%2Fdp%2FB097HP5ZMZ%2Fref%3Dsxin_13_pa_sp_search_thematic_sspa%3Fcontent-id%3Damzn1.sym.4e7a2229-074e-44de-95c4-9fd858f46295%253Aamzn1.sym.4e7a2229-074e-44de-95c4-9fd858f46295%26crid%3D1QJ2Z0KOR688P%26cv_ct_cx%3Deyeshadow%26keywords%3Deyeshadow%26pd_rd_i%3DB097HP5ZMZ%26pd_rd_r%3D081c5608-9884-4615-a068-e8040d6e2b04%26pd_rd_w%3DjWHJZ%26pd_rd_wg%3D0TwJC%26pf_rd_p%3D4e7a2229-074e-44de-95c4-9fd858f46295%26pf_rd_r%3DME1NVC79G6ZH41G7BNA7%26qid%3D1668625740%26sprefix%3Deyeshadow%252Caps%252C92%26sr%3D1-3-a73d1c8c-2fd2-4f19-aa41-2df022bcb241-spons%26sp_csd%3Dd2lkZ2V0TmFtZT1zcF9zZWFyY2hfdGhlbWF0aWM%26psc%3D1,Julep Eyeshadow 101 Crème to Powder Waterproof Eyeshadow Stick Duo Bronze Shimmer and Warm Gold Shimmer
d9,https://www.amazon.com/sspa/click?ie=UTF8&spc=MTo0MTkwNDk1ODY1OTQyNTUzOjE2Njg2MjU3NDA6c3Bfc2VhcmNoX3RoZW1hdGljOjIwMDEwMTQ1MjQ3MTA5ODo6Mzo6&url=%2FLUXAZA-Eyeshadow-Hypoallergenic-Highlighter-Waterproof%2Fdp%2FB09YGQ45Z7%2Fref%3Dsxin_13_pa_sp_search_thematic_sspa%3Fcontent-id%3Damzn1.sym.4e7a2229-074e-44de-95c4-9fd858f46295%253Aamzn1.sym.4e7a2229-074e-44de-95c4-9fd858f46295%26crid%3D1QJ2Z0KOR688P%26cv_ct_cx%3Deyeshadow%26keywords%3Deyeshadow%26pd_rd_i%3DB09YGQ45Z7%26pd_rd_r%3D081c5608-9884-4615-a068-e8040d6e2b04%26pd_rd_w%3DjWHJZ%26pd_rd_wg%3D0TwJC%26pf_rd_p%3D4e7a2229-074e-44de-95c4-9fd858f46295%26pf_rd_r%3DME1NVC79G6ZH41G7BNA7%26qid%3D1668625740%26sprefix%3Deyeshadow%252Caps%252C92%26sr%3D1-4-a73d1c8c-2fd2-4f19-aa41-2df022bcb241-spons%26sp_csd%3Dd2lkZ2V0TmFtZT1zcF9zZWFyY2hfdGhlbWF0aWM%26psc%3D1,LUXAZA 6PCS Cream Eyeshadow StickMatte And Shimmer Neutral Brown Eyeshadow Pencil CrayonHypoallergenic EyeshadowHighlighter Eye LinerPro Waterproof & Long Lasting Eye Shadow And Eyeliner Pen Sets
d10,https://www.amazon.com/sspa/click?ie=UTF8&spc=MTo0MTkwNDk1ODY1OTQyNTUzOjE2Njg2MjU3NDA6c3Bfc2VhcmNoX3RoZW1hdGljOjIwMDAxMzYwMjQ1MTc4MTo6NDo6&url=%2FAnastasia-Beverly-Hills-Eyeshadow-Single%2Fdp%2FB00KMKXUKA%2Fref%3Dsxin_13_pa_sp_search_thematic_sspa%3Fcontent-id%3Damzn1.sym.4e7a2229-074e-44de-95c4-9fd858f46295%253Aamzn1.sym.4e7a2229-074e-44de-95c4-9fd858f46295%26crid%3D1QJ2Z0KOR688P%26cv_ct_cx%3Deyeshadow%26keywords%3Deyeshadow%26pd_rd_i%3DB00KMKXUKA%26pd_rd_r%3D081c5608-9884-4615-a068-e8040d6e2b04%26pd_rd_w%3DjWHJZ%26pd_rd_wg%3D0TwJC%26pf_rd_p%3D4e7a2229-074e-44de-95c4-9fd858f46295%26pf_rd_r%3DME1NVC79G6ZH41G7BNA7%26qid%3D1668625740%26sprefix%3Deyeshadow%252Caps%252C92%26sr%3D1-5-a73d1c8c-2fd2-4f19-aa41-2df022bcb241-spons%26sp_csd%3Dd2lkZ2V0TmFtZT1zcF9zZWFyY2hfdGhlbWF0aWM%26psc%3D1,Anastasia Beverly Hills Eyeshadow Single
d11,https://aax-us-iad.amazon.com/x/c/RHJIl79wOHyoDdfs0BaZaDQAAAGEgdgzKAEAAAH2AQBOL0EgICAgICAgICAgICBOL0EgICAgICAgICAgICDSNrmp/https://www.amazon.com/dp/B01N8ZOQ5X?pd_rd_i=B01N8ZOQ5X&pf_rd_p=b000e0a0-9e93-480f-bf78-a83c8136dfcb&pf_rd_r=ME1NVC79G6ZH41G7BNA7&pd_rd_wg=0TwJC&pd_rd_w=Rkyuk&pd_rd_r=081c5608-9884-4615-a068-e8040d6e2b04,Julep Eyeshadow 101 Crème to Powder Waterproof Eyeshadow Stick Evergreen Shimmer
d12,https://www.amazon.com/sspa/click?ie=UTF8&spc=MTo2OTc1NzM2NjM1MTAyMjYzOjE2Njg2MjU3NDA6c3Bfc2VhcmNoX3RoZW1hdGljOjo6MDpCMDdYNkhEUzk2OnNlYXJjaA&url=%2FLOreal-Paris-Longwearing-Flake-Proof-Applicator%2Fdp%2FB07X6HDS96%2Fref%3Dsxin_15_pa_sp_search_thematic-asin_sspa%3Fcontent-id%3Damzn1.sym.4228d1d7-b9a2-4dcc-9504-1ef42bcf486a%253Aamzn1.sym.4228d1d7-b9a2-4dcc-9504-1ef42bcf486a%26crid%3D1QJ2Z0KOR688P%26cv_ct_cx%3Deyeshadow%26keywords%3Deyeshadow%26pd_rd_i%3DB07X6HDS96%26pd_rd_r%3D081c5608-9884-4615-a068-e8040d6e2b04%26pd_rd_w%3DqKrln%26pd_rd_wg%3D0TwJC%26pf_rd_p%3D4228d1d7-b9a2-4dcc-9504-1ef42bcf486a%26pf_rd_r%3DME1NVC79G6ZH41G7BNA7%26qid%3D1668625740%26sprefix%3Deyeshadow%252Caps%252C92%26sr%3D1-1-4a643ae4-6005-4b15-bc31-2c5125e2b25b-spons%26sp_csd%3Dd2lkZ2V0TmFtZT1zcF9zZWFyY2hfdGhlbWF0aWM%26psc%3D1,"L'Oreal Paris Makeup Brilliant Eyes Shimmer Liquid Eye Shadow Longwearing Lasting Shimmer Crease Resistant Flake-Proof Precision Applicator Quick Dry Non-Greasy Royal Onyx 0.1 oz. Do you want brilliant eyes? Coat your eyelids in brilliant shimmer with L'Oreal Paris brilliant eyes liquid eye shadow. This high-impact, high-shimmer liquid eye shadow stays true all day long! Yes, it Is true - brilliant eyes is transfer-proof! This means no fall-out, so you can wear shimmer eye shadow on your eyelids and not your cheeks! The luminous pearl pigments are lightweight and non-greasy for comfortable wear. In just one stroke, the soft doe foot applicator deposits just the right amount of product onto your eyelids for high shimmer payoff and blendable application. Available in 12 shades, you can customize your brilliant lid look by pairing shades, building intensity, or just wearing your favorite shades alone to achieve a daytime or nighttime look."
d13,https://www.amazon.com/NYX-PROFESSIONAL-MAKEUP-Ultimate-Eyeshadow/dp/B01IW02HX2/ref=sr_1_6?crid=1QJ2Z0KOR688P&keywords=eyeshadow&qid=1668625740&sprefix=eyeshadow%2Caps%2C92&sr=8-6,"NYX PROFESSIONAL MAKEUP Ultimate Shadow Palette Eyeshadow Palette - Warm Neutrals We named this collection the Ultimate Shadow Palette because that's exactly what it is-a pro-level palette packed with 16 high-performance eyeshadows and pressed pigments in a rainbow of t1-inspiRed shades. Available in four striking color combinations-Neutral-Cool, Neutral-Warm, Bright and Smokey/Highlight-each set features a vivid mix of velvety-rich textures and mesmerizing finishes that range from mattes and satins to shimmers and metallics."
d14,https://www.amazon.com/Julep-Eyeshadow-Hypoallergenic-Waterproof-Available/dp/B01LW1983J/ref=sr_1_7?crid=1QJ2Z0KOR688P&keywords=eyeshadow&qid=1668625740&sprefix=eyeshadow%2Caps%2C92&sr=8-7,Julep Eyeshadow 101 Crème to Powder Waterproof Eyeshadow Stick Champagne Shimmer
d15,https://www.amazon.com/COVERGIRL-Enhancers-Shadow-Sheerly-Packaging/dp/B001ESN2TS/ref=sr_1_8?crid=1QJ2Z0KOR688P&keywords=eyeshadow&qid=1668625740&sprefix=eyeshadow%2Caps%2C92&sr=8-8,COVERGIRL Eye Enhancers Eyeshadow Kit Sheerly Nudes 4 Colors Product Description
d16,https://www.amazon.com/Colours-Eyeshadow-Rechoo-Professional-Colorful/dp/B08JQ6C42J/ref=sr_1_9?crid=1QJ2Z0KOR688P&keywords=eyeshadow&qid=1668625740&sprefix=eyeshadow%2Caps%2C92&sr=8-9,99 Colors Eye shadow Palette Glitter Eye Makeup Rechoo Rainbow Colors Fusion Eyeshadow Palette Professional Matte Makeup Pallet Colorful Powder Long Lasting Eye Shadow
d17,https://www.amazon.com/Eyeshadow-Pigmented-Waterproof-Makeup-Seductress/dp/B07JG4SPLY/ref=sr_1_10?crid=1QJ2Z0KOR688P&keywords=eyeshadow&qid=1668625740&sprefix=eyeshadow%2Caps%2C92&sr=8-10,Matte Eyeshadow Palette Pro 18 Colors Pigmented Shimmer Glitter Eye Shadow Palette Blendable Long Lasting Waterproof Makeup Cosmetics Halloween Makeup Kit (01# Seductress)
d18,https://www.amazon.com/e-l-f-Liquid-Metallic-Eyeshadows-Moon/dp/B0947DWWTN/ref=sr_1_11?crid=1QJ2Z0KOR688P&keywords=eyeshadow&qid=1668625740&sprefix=eyeshadow%2Caps%2C92&sr=8-11,"e.l.f. Liquid Metallic Eyeshadow Gel Formula Multi-Dimensional Finish For Bold Eye Looks One-Swipe Coverage Vegan & Cruelty-Free Moon 0.1 Fl Oz Get an amped up eye look with this formula packed full of pearls for a high shine, reflective, one-swipe metallic coverage. Formulated for comfortable wear, this long-lasting opaque liquid eyeshadow delivers high-impact, multi-dimensional metallic in a quick-drying gel base."
d19,https://www.amazon.com/Eyeshadow-Palette-Lasting-Reflective-Shimmer/dp/B07LF13C2C/ref=sr_1_12?crid=1QJ2Z0KOR688P&keywords=eyeshadow&qid=1668625740&sprefix=eyeshadow%2Caps%2C92&sr=8-12,UCANBE 18 Colors Aromas Nude Eyeshadow Palette Long Lasting Multi Reflective Shimmer Matte Glitter Pressed Pearls Eye Shadow Makeup Pallet
d20,https://www.amazon.com/LAURA-GELLER-NEW-YORK-Delectables/dp/B0BGR4TG4R/ref=sr_1_13?crid=1QJ2Z0KOR688P&keywords=eyeshadow&qid=1668625740&sprefix=eyeshadow%2Caps%2C92&sr=8-13,"LAURA GELLER NEW YORK The Delectables Earthy Essentials Baked Eyeshadow Palette | 14 Pigmented Eyeshadows Blendable Natural Look These eyeshadows are so delicious, they’re almost good enough to eat! From the smooth, blendable texture that melts onto your lids to the classic, versatile and neutral shades, you’re sure to fall in love with Laura Geller’s The Delectables Baked Eyeshadow Palette. It includes 14 shades of our iconic cream-to-powder baked eyeshadows, in a mix of matte and shimmer finishes. Choose from neutral eyeshadows or any of the nude, green or pink eyeshadow shades in the collection."
d21,https://www.amazon.com/SEEUI-Eyeshadow-Palette-Shimmer-Blendable/dp/B096W6VWKS/ref=sr_1_14?crid=1QJ2Z0KOR688P&keywords=eyeshadow&qid=1668625740&sprefix=eyeshadow%2Caps%2C92&sr=8-14,SEEUI Eyeshadow Palette 24 Color Eye Makeup Palette Matte Shimmer Eyeshadow Pallet Long Lasting Blendable Natural Colors Make Up Eye Shadows
d22,https://www.amazon.com/CoverGirl-Eye-Enhancers-4-Kit-Shadow/dp/B00L5SMFJU/ref=sr_1_15?crid=1QJ2Z0KOR688P&keywords=eyeshadow&qid=1668625740&sprefix=eyeshadow%2Caps%2C92&sr=8-15,"Covergirl Eye Enhancers Eye Shadow Palette Natural Nudes 0.19 Ounce This eyeshadow kit is a collection of great shades handpicked by our makeup pros and designed to make your eye look go from day to night. They shades in each eyeshadow kit blend effortlessly to bring your eyes out beautifully, without overshadowing. Experiment using them together or as single shades."
d23,https://www.amazon.com/Eyeshadow-Waterproof-Professional-Cosmetic-BESTLAND/dp/B073ZBGLJF/ref=sr_1_16?crid=1QJ2Z0KOR688P&keywords=eyeshadow&qid=1668625740&sprefix=eyeshadow%2Caps%2C92&sr=8-16,2 Pack 12 Colors Makeup Nude Colors Eyeshadow Palette Natural Nude Matte Shimmer Glitter Pigment Eye Shadow Pallete Set Waterproof Smokey Professional Beauty Makeup Kit BestLand (2 PCS)
d24,https://www.amazon.com/sspa/click?ie=UTF8&spc=MTo4OTc5Mzc5OTExOTg5NzM5OjE2Njg2MjU3NDA6c3BfbXRmOjIwMDA1OTYwOTY2MzU5ODo6MDo6&url=%2FErinde-Eyeshadow-Pigmented-Blendable-Professional%2Fdp%2FB09J88WHF1%2Fref%3Dsr_1_17_sspa%3Fcrid%3D1QJ2Z0KOR688P%26keywords%3Deyeshadow%26qid%3D1668625740%26sprefix%3Deyeshadow%252Caps%252C92%26sr%3D8-17-spons%26sp_csd%3Dd2lkZ2V0TmFtZT1zcF9tdGY%26psc%3D1%26smid%3DA36LYO8UMBYZGT,Erinde 10 Colors Eyeshadow Palette Matte Black Grey Eyeshadow Ultra-Blendable High Pigmented Long Lasting Neutral Nude Eye Makeup Palette with Professional Brush Suitable for Older Women #04
d25,https://www.amazon.com/sspa/click?ie=UTF8&spc=MTo4OTc5Mzc5OTExOTg5NzM5OjE2Njg2MjU3NDA6c3BfbXRmOjIwMDA4Nzk0MjUzOTI5ODo6MDo6&url=%2FAlleyoop-Cream-Eyeshadow-Sticks-Matte%2Fdp%2FB08XBHRS9B%2Fref%3Dsr_1_18_sspa%3Fcrid%3D1QJ2Z0KOR688P%26keywords%3Deyeshadow%26qid%3D1668625740%26sprefix%3Deyeshadow%252Caps%252C92%26sr%3D8-18-spons%26sp_csd%3Dd2lkZ2V0TmFtZT1zcF9tdGY%26psc%3D1,Alleyoop 11th Hour Cream Eyeshadow Sticks - Taupe Dollar (Matte) - Award-winning - Smudge-Proof and Crease Proof for Over 11 Hours - Easy-To-Apply and Compact for Travel - Cruelty-Free & Vegan 0.05 Oz
d26,https://www.amazon.com/sspa/click?ie=UTF8&spc=MTo4OTc5Mzc5OTExOTg5NzM5OjE2Njg2MjU3NDA6c3BfbXRmOjIwMDA1OTQ1MDQ0NDgyMTo6MDo6&url=%2FSigma-Beauty-Neutrals-Eyeshadow-dual-ended%2Fdp%2FB08HSPSPN6%2Fref%3Dsr_1_19_sspa%3Fcrid%3D1QJ2Z0KOR688P%26keywords%3Deyeshadow%26qid%3D1668625740%26sprefix%3Deyeshadow%252Caps%252C92%26sr%3D8-19-spons%26sp_csd%3Dd2lkZ2V0TmFtZT1zcF9tdGY%26psc%3D1,Sigma Beauty Warm Neutrals Eyeshadow Palette - 14 Warm Eyeshadow Shades in Matte Shimmer and Metalic Finishes - Highly Pigmented Vegan Eye Makeup Palette - Clean Beauty Products
d27,https://www.amazon.com/sspa/click?ie=UTF8&spc=MTo4OTc5Mzc5OTExOTg5NzM5OjE2Njg2MjU3NDA6c3BfbXRmOjIwMDA1OTQ1MDQ0NDcyMTo6MDo6&url=%2FSigma-Beauty-Spicy-Eyeshadow-Palette%2Fdp%2FB08VBH52FM%2Fref%3Dsr_1_20_sspa%3Fcrid%3D1QJ2Z0KOR688P%26keywords%3Deyeshadow%26qid%3D1668625740%26sprefix%3Deyeshadow%252Caps%252C92%26sr%3D8-20-spons%26sp_csd%3Dd2lkZ2V0TmFtZT1zcF9tdGY%26psc%3D1%26smid%3DAHF186UWUDO60,Sigma Beauty On-the-Go Eyeshadow Palette - Spicy - 9 Bold Eyeshadow Shades in Matte Shimmer and Metalic Finishes - Highly Pigmented Vegan Eye Makeup Palette - Clean Beauty Products
d28,https://www.amazon.com/WILD-Color-Icon-Glitter-Single/dp/B0797VJ9WN/ref=sr_1_21?crid=1QJ2Z0KOR688P&keywords=eyeshadow&qid=1668625740&sprefix=eyeshadow%2Caps%2C92&sr=8-21,"Wet n Wild Color Icon Glitter Eyeshadow Shimmer Spiked Go glam with this uber-pigmented glitter single. Infused with Vitamin E, its glitterati-worthy color goes on silky smooth, moisturizes skin, and blends like butter. And, it’ll stay put no matter what the night holds."
d29,https://www.amazon.com/Best-Pro-Eyeshadow-Palette-Makeup/dp/B01CNZMMV4/ref=sr_1_22?crid=1QJ2Z0KOR688P&keywords=eyeshadow&qid=1668625740&sprefix=eyeshadow%2Caps%2C92&sr=8-22,Best Pro Eyeshadow Palette Makeup - Matte Shimmer 16 Colors - Highly Pigmented - Professional Nudes Warm Natural Bronze Neutral Smoky Cosmetic Eye Shadows
d30,https://www.amazon.com/Rimmel-Magnifeyes-Eyeshadow-Palette-Electric/dp/B07FH3P7QK/ref=sr_1_23?crid=1QJ2Z0KOR688P&keywords=eyeshadow&qid=1668625740&sprefix=eyeshadow%2Caps%2C92&sr=8-23,"Rimmel Magnif'eyes Eyeshadow Palette Electric Violet Edition (3614227182486) Long lasting, Crease proof, Water proof. Our new ultra-blendable formula comes in a range of finishes from mattes, shimmers to high glitter. Dermatologist tested"
d31,https://www.amazon.com/Eyeshadow-Ultra-Blendable-Pigmented-Matallic-Waterproof/dp/B08TWSYWQ4/ref=sr_1_24?crid=1QJ2Z0KOR688P&keywords=eyeshadow&qid=1668625740&sprefix=eyeshadow%2Caps%2C92&sr=8-24,Nude Gold Eyeshadow Palette Natural Naked Smokey Warm Neutral 15 Shades ecofavor Ultra-Blendable High Pigmented Matte Shimmer Matallic Long Lasting Waterproof Eye Shadow Pallet Travel Size Makeup
d32,https://www.amazon.com/Bite-Size-Eyeshadows-Blendable-Ultra-Pigmented-Shimmer/dp/B085P2FL8B/ref=sr_1_25?crid=1QJ2Z0KOR688P&keywords=eyeshadow&qid=1668625740&sprefix=eyeshadow%2Caps%2C92&sr=8-25,"e.l.f. Bite-Size Eyeshadows Creamy Blendable Ultra-Pigmented & Easy to Apply On-the-go Long-lasting Vegan & Cruelty-Free Rose Water 0.12 Oz The Bite size eyeshadow is your secret weapon to a flawless face. This travel-friendly mini palette is the perfect size to go everywhere with you. The Luxe formula is smooth, creamy, blendable, and ultra-pigmented. Mix and match shades to achieve everything from a natural look to high drama eyes. After you apply your primer, foundation, and setting powder, apply as desired. For a more dramatic look, Use along with bold liquid eyeliner. E.L.F. Makes the best of Beauty accessible to every eye, lip, and face. Your originality is infinite, and we are inspired by what makes you unique. From the early explorer to the trend-obsessed beauty junkie-glam or bare faced, minimalist, maximalist and every look in between-we are for every eye, lip, and face. Proud to be 100% vegan and cruelty-free, worldwide."
d33,https://www.amazon.com/Revlon-ColorStay-Shadow-Passionate-0-16oz/dp/B0105Z23J0/ref=sr_1_26?crid=1QJ2Z0KOR688P&keywords=eyeshadow&qid=1668625740&sprefix=eyeshadow%2Caps%2C92&sr=8-26,"Revlon ColorStay Day to Night Eyeshadow Quad Longwear Shadow Palette with Transitional Shades and Buttery Soft Feel Crease & Smudge Proof 528 Passionate  0.16 oz The REVLON ColorStay 16 Hour Eye Shadow Quad is an expertly color-coordinated palette for your most gorgeous eyes yet. Rich, velvety shadows blend smoothly for a beautiful, luxurious color that wears for up to 16 hours. Ophthalmologist tested and non-irritating. These shadows won't crease, fade or smudge. Available in 12 palettes."
d34,https://www.amazon.com/HAUS-LABORATORIES-Lady-Gaga-Eyeshadow/dp/B07RS1NZ72/ref=sr_1_27?crid=1QJ2Z0KOR688P&keywords=eyeshadow&qid=1668625740&sprefix=eyeshadow%2Caps%2C92&sr=8-27,HAUS LABORATORIES By Lady Gaga: GLAM ATTACK LIQUID EYESHADOW | Pigmented Liquid Eyeshadow Available in 13 Shimmer & 4 Metallic Colors Long Lasting & Blendable Eye Makeup Vegan & Cruelty-Free
d35,https://www.amazon.com/Urban-Decay-Naked3-Eyeshadow-Palette/dp/B095PSJ7QV/ref=sr_1_28?crid=1QJ2Z0KOR688P&keywords=eyeshadow&qid=1668625740&sprefix=eyeshadow%2Caps%2C92&sr=8-28,Urban Decay Naked3 Mini Eyeshadow Palette - Pigmented Eye Makeup Palette For On the Go - Ultra Blendable - Up to 12 Hour Wear
